{
  "schema": "amf.capability-mcp-conformance/v2",
  "advertisedTools": ["search", "read", "propose", "proposal_status", "status"],
  "authorizationMatrix": [
    { "tool": "search", "capability": "search", "permission": "fabric:search", "purpose": ["memory_recall", "conversation_recall", "context_recall"], "scopeBinding": "required_scope_ref", "failure": "forbidden" },
    { "tool": "read", "capability": "read", "permission": "fabric:read", "purpose": ["memory_recall", "conversation_recall", "context_recall"], "scopeBinding": "required_scope_ref", "failure": "not_found" },
    { "tool": "propose", "capability": "propose", "permission": "fabric:propose", "purpose": ["memory_curation"], "scopeBinding": "required_scope_ref", "failure": "forbidden" },
    { "tool": "proposal_status", "capability": "proposal_status", "permission": "fabric:proposal_status", "purpose": ["memory_curation"], "scopeBinding": "required_scope_ref", "failure": "not_found" },
    { "tool": "status", "capability": "status", "permission": "fabric:status", "purpose": [], "scopeBinding": "none", "failure": "forbidden" }
  ],
  "rankingPolicy": { "revision": "capability-mcp-v2-rank/v2", "tenantMode": "single_tenant_reject_mixed", "scopeSetSemantics": "authorized_union", "identityDedup": "tenant_id_plus_scope_id", "admissionOrder": ["current_authorization", "scope_membership", "purpose_kind"], "candidateLanes": ["exact", "lexical", "fuzzy", "vector"], "rankingOrder": ["exact_anchor", "authority", "freshness", "reciprocal_rank_fusion", "recency", "opaque_resource_id"], "fusion": "reciprocal_rank_fusion", "rrfK": 60, "authorityDirection": "higher_ordinal_first", "authorityDomain": [{ "name": "unknown", "ordinal": 0 }, { "name": "derived_projection", "ordinal": 1 }, { "name": "attributed_observation", "ordinal": 2 }, { "name": "reviewed_canonical", "ordinal": 3 }, { "name": "source_authority", "ordinal": 4 }], "freshnessDirection": "higher_ordinal_first", "freshnessReference": "snapshot_ranked_at_utc", "freshnessTimestampOrder": ["effective_at", "observed_at", "source_modified_at", "ingested_at"], "futureTimestampHandling": "reject_candidate", "expiredCandidateHandling": "exclude_before_ranking", "freshnessDomain": [{ "name": "unknown", "ordinal": 0, "minAgeSeconds": null, "maxAgeSeconds": null }, { "name": "old", "ordinal": 1, "minAgeSeconds": 2592001, "maxAgeSeconds": null }, { "name": "aged", "ordinal": 2, "minAgeSeconds": 604801, "maxAgeSeconds": 2592000 }, { "name": "recent", "ordinal": 3, "minAgeSeconds": 86401, "maxAgeSeconds": 604800 }, { "name": "current", "ordinal": 4, "minAgeSeconds": 0, "maxAgeSeconds": 86400 }], "snapshotBinding": ["authorization_revision", "coverage_revision", "lane_positions", "ranking_policy_revision", "ranked_at_utc"] },
  "scenarios": [
    { "id": "v1_defaults_scope_ref", "request": { "name": "search", "arguments": { "query": "Find a summary", "scopes": [{ "tenantId": "tenant_alpha", "type": "project", "scopeId": "atlas" }], "purpose": "memory_recall", "limit": 10 } }, "expected": { "ok": true, "outcome": "found", "items": [{ "id": "rid_alpha0001", "kind": "canonical_memory", "text": "A synthetic memory result.", "admission": "authorized", "ranking": { "position": 1, "reasons": ["exact_anchor", "authority"] }, "contradiction": "none" }, { "id": "rid_beta00002", "kind": "document", "text": "A synthetic document result.", "admission": "authorized", "ranking": { "position": 2, "reasons": ["hybrid_similarity", "recency"] }, "contradiction": "unknown" }], "nextCursor": null, "coverage": { "state": "complete", "requestedKinds": ["canonical_memory", "document"], "coveredKinds": ["canonical_memory", "document"], "uncoveredKinds": [], "reasons": [] } } },
    { "id": "explicit_conversation", "request": { "name": "search", "arguments": { "query": "Find a message", "kinds": ["conversation"], "scopes": [{ "tenantId": "tenant_alpha", "type": "project", "scopeId": "atlas" }], "purpose": "conversation_recall" } }, "expected": { "ok": true, "outcome": "found", "items": [{ "id": "rid_gamma0003", "kind": "conversation", "text": "A synthetic visible message.", "admission": "authorized", "ranking": { "position": 1, "reasons": ["freshness"] }, "contradiction": "none" }], "nextCursor": null, "coverage": { "state": "complete", "requestedKinds": ["conversation"], "coveredKinds": ["conversation"], "uncoveredKinds": [], "reasons": [] } } },
    { "id": "explicit_resource_context", "request": { "name": "search", "arguments": { "query": "Find Atlas context", "kinds": ["resource"], "scopes": [{ "tenantId": "tenant_alpha", "type": "project", "scopeId": "atlas" }], "purpose": "context_recall" } }, "expected": { "ok": true, "outcome": "found", "items": [{ "id": "rid_resource04", "kind": "resource", "text": "A synthetic resource context.", "admission": "authorized", "ranking": { "position": 1, "reasons": ["exact_anchor", "freshness"] }, "contradiction": "none" }], "nextCursor": null, "coverage": { "state": "complete", "requestedKinds": ["resource"], "coveredKinds": ["resource"], "uncoveredKinds": [], "reasons": [] } } },
    { "id": "notice_only_delivery", "request": { "name": "search", "arguments": { "query": "Find relevant peer context", "kinds": ["conversation"], "scopes": [{ "tenantId": "tenant_alpha", "type": "project", "scopeId": "atlas" }], "purpose": "context_recall", "delivery": "notice" } }, "expected": { "ok": true, "outcome": "notice", "notice": { "mode": "notice_only", "state": "available", "candidateCount": 2, "expansionRequired": true } } },
    { "id": "denied_conversation_purpose", "request": { "name": "search", "arguments": { "query": "Find a message", "kinds": ["conversation"], "scopes": [{ "tenantId": "tenant_alpha", "type": "project", "scopeId": "atlas" }], "purpose": "memory_recall" } }, "expected": { "ok": false, "outcome": "forbidden" } },
    { "id": "denied_resource_scope", "request": { "name": "search", "arguments": { "query": "Find a resource", "kinds": ["resource"], "scopes": [{ "tenantId": "tenant_alpha", "type": "project", "scopeId": "outside" }], "purpose": "context_recall" } }, "expected": { "ok": false, "outcome": "forbidden" } },
    { "id": "read_found_reauthorized", "request": { "name": "read", "arguments": { "id": "rid_alpha0001", "scopes": [{ "tenantId": "tenant_alpha", "type": "project", "scopeId": "atlas" }], "purpose": "memory_recall" } }, "expected": { "ok": true, "outcome": "found", "resource": { "id": "rid_alpha0001", "kind": "canonical_memory", "text": "A synthetic memory result.", "admission": "authorized", "ranking": { "position": 1, "reasons": ["exact_anchor"] }, "contradiction": "none" } } },
    { "id": "read_no_existence_oracle", "request": { "name": "read", "arguments": { "id": "rid_alpha0001", "scopes": [{ "tenantId": "tenant_alpha", "type": "project", "scopeId": "outside" }], "purpose": "memory_recall" } }, "expected": { "ok": false, "outcome": "not_found" } },
    { "id": "read_revoked_reauthorization", "request": { "name": "read", "arguments": { "id": "rid_alpha0001", "scopes": [{ "tenantId": "tenant_alpha", "type": "project", "scopeId": "atlas" }], "purpose": "memory_recall" } }, "expected": { "ok": false, "outcome": "not_found" } },
    { "id": "partial_coverage", "request": { "name": "search", "arguments": { "query": "Find all resource context", "kinds": ["resource"], "scopes": [{ "tenantId": "tenant_alpha", "type": "project", "scopeId": "atlas" }], "purpose": "context_recall" } }, "expected": { "ok": true, "outcome": "found", "items": [], "nextCursor": null, "coverage": { "state": "partial", "requestedKinds": ["resource"], "coveredKinds": [], "uncoveredKinds": ["resource"], "reasons": ["unavailable"] } } },
    { "id": "contradiction_visible", "request": { "name": "search", "arguments": { "query": "Find a contested fact", "scopes": [{ "tenantId": "tenant_alpha", "type": "project", "scopeId": "atlas" }], "purpose": "memory_recall" } }, "expected": { "ok": true, "outcome": "found", "items": [{ "id": "rid_conflict05", "kind": "canonical_memory", "text": "A synthetic contested fact.", "admission": "authorized", "ranking": { "position": 1, "reasons": ["authority"] }, "contradiction": "present" }], "nextCursor": null, "coverage": { "state": "complete", "requestedKinds": ["canonical_memory", "document"], "coveredKinds": ["canonical_memory", "document"], "uncoveredKinds": [], "reasons": [] } } },
    { "id": "stable_opaque_paging", "request": { "name": "search", "arguments": { "query": "Find a summary", "scopes": [{ "tenantId": "tenant_alpha", "type": "project", "scopeId": "atlas" }], "purpose": "memory_recall", "limit": 1, "cursor": "cur_cursorpage000001" } }, "expected": { "ok": true, "outcome": "found", "items": [{ "id": "rid_beta00002", "kind": "document", "text": "A synthetic document result.", "admission": "authorized", "ranking": { "position": 2, "reasons": ["hybrid_similarity", "recency"] }, "contradiction": "unknown" }], "nextCursor": null, "coverage": { "state": "complete", "requestedKinds": ["canonical_memory", "document"], "coveredKinds": ["canonical_memory", "document"], "uncoveredKinds": [], "reasons": [] } } },
    { "id": "proposal_queued", "request": { "name": "propose", "arguments": { "scope": { "tenantId": "tenant_alpha", "type": "project", "scopeId": "atlas" }, "claim": "A synthetic proposed fact.", "purpose": "memory_curation", "idempotencyKey": "req_proposal0001" } }, "expected": { "ok": true, "outcome": "queued", "id": "rid_delta0004" } },
    { "id": "proposal_lifecycle", "request": { "name": "proposal_status", "arguments": { "id": "rid_delta0004", "scopes": [{ "tenantId": "tenant_alpha", "type": "project", "scopeId": "atlas" }], "purpose": "memory_curation" } }, "expected": { "ok": true, "outcome": "pending", "proposal": { "id": "rid_delta0004", "state": "review_required" } } },